{
  "date": "2026-09-19",
  "frontend_entry": "data/public/latest.json",
  "generated_at": "2026-09-19T00:10:51+00:00",
  "generated_paths": {
    "exports_csv": "data/exports/papers.csv",
    "exports_daily_csv": "data/exports/daily_papers.csv",
    "exports_jsonl": "data/exports/papers.jsonl",
    "exports_notes_index": "data/exports/notes_index.csv",
    "exports_reading_status": "data/exports/reading_status.csv",
    "json": "daily/2026/09/2026-09-19.json",
    "markdown": "daily/2026/09/2026-09-19.md",
    "public_curriculum_progress": "data/public/curriculum_progress.json",
    "public_daily_index": "data/public/daily_index.json",
    "public_knowledge_graph": "data/public/knowledge_graph.json",
    "public_latest": "data/public/latest.json",
    "public_notes_index": "data/public/notes_index.json",
    "public_papers_index": "data/public/papers_index.json",
    "public_reading_status": "data/public/reading_status.json",
    "state_notes_index": "data/state/notes_index.json",
    "state_papers": "data/state/papers.jsonl",
    "state_reading_status": "data/state/reading_status.json",
    "state_run_history": "data/state/run_history.json"
  },
  "knowledge_graph_delta": [
    "paper:biorxiv:10.64898/2026.08.25.746978",
    "paper:biorxiv:10.64898/2026.06.22.733700",
    "paper:biorxiv:10.64898/2026.06.28.735033",
    "paper:biorxiv:10.64898/2026.09.09.750388",
    "paper:biorxiv:10.64898/2026.09.06.749703",
    "paper:biorxiv:10.64898/2026.09.07.749904"
  ],
  "learning_route_position": "v0.4 GitHub-owned note bridge",
  "next_actions": [
    "Review S-level candidate",
    "Update reading status after skim",
    "Promote durable concepts into the knowledge graph"
  ],
  "papers": [
    {
      "abstract": "From animal societies to self-organizing multi-agent systems, collectives adapt their group structure to tasks and environments. However, how they determine appropriate group sizes and the number of subgroups to form remains unclear. We formulate the Group Size and Number Regulation Problem (GSNRP), which asks how individuals regulate group sizes and numbers using only local information. In a first step, we establish a graph-theoretic model demonstrating that simple following behavior suffices to form group structures that match theoretical expectations, but is insufficient for active regulation of group size and number. In a second step, we operationalize individual group-size preferences in a decentralized fission-fusion mechanism based on perceived group size. Through multi-agent simulations, we validate that this mechanism achieves stable convergence across three signaling regimes, from position-only sensing to continuous group-size communication. Using tracking data from wild white-nosed coatis (mammals in the raccoon family), we calibrate individual group-size preferences and show that the controller recovers selected group-size, subgroup-count, and transition statistics. This in-sample case study demonstrates descriptive consistency with natural fission-fusion dynamics without establishing the underlying behavioral mechanism. These results suggest that natural and engineered collectives may share local principles of perception, preference, and response for regulating group structure.",
      "authors": [
        "Zhang, T.",
        "Lee, S.",
        "Hamann, H."
      ],
      "categories": [
        "animal behavior and cognition"
      ],
      "citation_count": null,
      "classic_status": null,
      "code_url": null,
      "deep_read_note_url": null,
      "difficulty": null,
      "enrichment_sources": [],
      "existing_note_url": null,
      "external_ids": {
        "DOI": "10.64898/2026.08.25.746978"
      },
      "field": null,
      "fields_of_study": [
        "Psychology"
      ],
      "id": "biorxiv:10.64898/2026.08.25.746978",
      "identifiers": {
        "DOI": "10.64898/2026.08.25.746978",
        "doi": "10.64898/2026.08.25.746978",
        "server": "biorxiv"
      },
      "influential_citation_count": null,
      "institutions": [],
      "latest_note_url": null,
      "note_count": 0,
      "open_access_pdf_url": null,
      "pdf_url": null,
      "project_url": null,
      "published_at": "2026-09-12",
      "published_date": "2026-09-12",
      "reading_advice": "save_for_later",
      "reading_status": "backlog",
      "recommendation_level": "B",
      "score": 0.653,
      "scores": {
        "classic_value": 0.35,
        "engineering_transferability": 0.48,
        "recency": 0.78,
        "source_quality": 0.68,
        "total": 0.653,
        "user_relevance": 0.75
      },
      "selected_for_s_level": false,
      "source": "biorxiv",
      "source_group": "cognition_social",
      "source_type": "recent_7d",
      "source_url": "https://doi.org/10.64898/2026.08.25.746978",
      "suggested_note_title": null,
      "suggested_note_type": null,
      "tags": [
        "animal behavior and cognition",
        "cognition_social",
        "biorxiv"
      ],
      "title": "Self-organized Regulation of Group Size and Number in Natural and Artificial Collectives",
      "title_zh": null,
      "topics": [
        "cognition"
      ],
      "url": "https://doi.org/10.64898/2026.08.25.746978",
      "venue": "bioRxiv",
      "why_recommended": "Ranked by recency signal across configured topics."
    },
    {
      "abstract": "Aposematic signals convey information about prey unpalatability to potential predators. Such signals are defined as advertisements, with prey usually signalling unpalatability before an attack. Overlooked, however, is whether signals presented after an attack can function as aposematic warnings and influence the efficacy of defense. Here, we test if post-attack signals can be aposematic by observing fish predators responding to prey (Ostracoda, Cypridinidae) that produce bioluminescence following an attack. By manipulating potential chemical defenses of prey, and by comparing feeding responses to both bioluminescent and nonluminescent prey, we provide multiple lines of evidence to show bioluminescent prey are unpalatable and use post-attack bioluminescence as an aposematic signal. First, live, bioluminescent prey secrete bioluminescence only after being attacked. Second, predatory fishes rarely consumed bioluminescent prey, especially compared to nonluminescent alternatives. Third, because fishes readily ate bioluminescent prey that had been treated (frozen or boiled), which should remove defenses, bioluminescent species likely possess some unidentified defense over nonluminescent relatives. Finally, over the course of four experimental trials, predators were less likely to consume bioluminescent prey as their cumulative exposure to bioluminescent displays increased, indicative of learning. Post-attack aposematic signals, like bioluminescence, may be as common and effective a defensive strategy as pre-attack signals.",
      "authors": [
        "Hensley, N. M.",
        "Shulman, L. M.",
        "Rivers, T. J.",
        "Gerrish, G. A.",
        "Herbert-Read, J.",
        "Morin, J. G."
      ],
      "categories": [
        "animal behavior and cognition"
      ],
      "citation_count": null,
      "classic_status": null,
      "code_url": null,
      "deep_read_note_url": null,
      "difficulty": null,
      "enrichment_sources": [],
      "existing_note_url": null,
      "external_ids": {
        "DOI": "10.64898/2026.06.22.733700"
      },
      "field": null,
      "fields_of_study": [
        "Psychology"
      ],
      "id": "biorxiv:10.64898/2026.06.22.733700",
      "identifiers": {
        "DOI": "10.64898/2026.06.22.733700",
        "doi": "10.64898/2026.06.22.733700",
        "server": "biorxiv"
      },
      "influential_citation_count": null,
      "institutions": [],
      "latest_note_url": null,
      "note_count": 0,
      "open_access_pdf_url": null,
      "pdf_url": null,
      "project_url": null,
      "published_at": "2026-09-12",
      "published_date": "2026-09-12",
      "reading_advice": "save_for_later",
      "reading_status": "backlog",
      "recommendation_level": "B",
      "score": 0.653,
      "scores": {
        "classic_value": 0.35,
        "engineering_transferability": 0.48,
        "recency": 0.78,
        "source_quality": 0.68,
        "total": 0.653,
        "user_relevance": 0.75
      },
      "selected_for_s_level": false,
      "source": "biorxiv",
      "source_group": "cognition_social",
      "source_type": "recent_7d",
      "source_url": "https://doi.org/10.64898/2026.06.22.733700",
      "suggested_note_title": null,
      "suggested_note_type": null,
      "tags": [
        "animal behavior and cognition",
        "cognition_social",
        "biorxiv"
      ],
      "title": "Post-attack bioluminescence is an aposematic signal in luminin ostracods",
      "title_zh": null,
      "topics": [
        "cognition"
      ],
      "url": "https://doi.org/10.64898/2026.06.22.733700",
      "venue": "bioRxiv",
      "why_recommended": "Ranked by recency signal across configured topics."
    },
    {